{
  "schema_version": "single-prediction-bundle/2.0",
  "race_id": "20260719_hanshin_11",
  "generated_at": "2026-07-19T12:00:00+09:00",
  "model_version": "dummy-model-0.0.0",
  "core_version": "dummy-core-0.0.0",
  "product_version": "single-08-prototype-0.1.0",
  "status": "ok",
  "warnings": [],
  "race_info": {
    "race_id": "20260719_hanshin_11",
    "date": "2026-07-19",
    "venue": "阪神",
    "meeting_id": "20260719_hanshin",
    "race_no": 11,
    "post_time": "15:40",
    "distance": 1800,
    "surface": "dirt",
    "course": "右",
    "class_label": "3歳以上1勝クラス",
    "grade": null,
    "field_size": 15,
    "race_status": "scheduled"
  },
  "evaluation": {
    "status": "ok",
    "world": "dummy_world",
    "sub_world": "dummy_sub",
    "runners": [
      {
        "candidate_id": "c07",
        "horse_number": 7,
        "horse_name": "サンプルホースA",
        "model_rank": 1,
        "win_prob": 0.22,
        "mark": "honmei",
        "mark_rank": 1
      },
      {
        "candidate_id": "c03",
        "horse_number": 3,
        "horse_name": "サンプルホースB",
        "model_rank": 2,
        "win_prob": 0.15,
        "mark": "taikou",
        "mark_rank": 1
      },
      {
        "candidate_id": "c12",
        "horse_number": 12,
        "horse_name": "サンプルホースC",
        "model_rank": 3,
        "win_prob": 0.11,
        "mark": "ana",
        "mark_rank": 1
      },
      {
        "candidate_id": "c05",
        "horse_number": 5,
        "horse_name": "サンプルホースD",
        "model_rank": 4,
        "win_prob": 0.09,
        "mark": "chuuken",
        "mark_rank": 1
      },
      {
        "candidate_id": "c01",
        "horse_number": 1,
        "horse_name": "サンプルホースE",
        "model_rank": 5,
        "win_prob": 0.07,
        "mark": "none"
      },
      {
        "candidate_id": "c02",
        "horse_number": 2,
        "horse_name": "サンプルホースF",
        "model_rank": 6,
        "win_prob": 0.06,
        "mark": "none"
      },
      {
        "candidate_id": "c04",
        "horse_number": 4,
        "horse_name": "サンプルホースG",
        "model_rank": 7,
        "win_prob": 0.05,
        "mark": "none"
      },
      {
        "candidate_id": "c06",
        "horse_number": 6,
        "horse_name": "サンプルホースH",
        "model_rank": 8,
        "win_prob": 0.05,
        "mark": "none"
      },
      {
        "candidate_id": "c08",
        "horse_number": 8,
        "horse_name": "サンプルホースI",
        "model_rank": 9,
        "win_prob": 0.04,
        "mark": "none"
      },
      {
        "candidate_id": "c09",
        "horse_number": 9,
        "horse_name": "サンプルホースJ",
        "model_rank": 10,
        "win_prob": 0.04,
        "mark": "none"
      },
      {
        "candidate_id": "c10",
        "horse_number": 10,
        "horse_name": "サンプルホースK",
        "model_rank": 11,
        "win_prob": 0.03,
        "mark": "none"
      },
      {
        "candidate_id": "c11",
        "horse_number": 11,
        "horse_name": "サンプルホースL",
        "model_rank": 12,
        "win_prob": 0.03,
        "mark": "none"
      },
      {
        "candidate_id": "c13",
        "horse_number": 13,
        "horse_name": "サンプルホースM",
        "model_rank": 13,
        "win_prob": 0.02,
        "mark": "none"
      },
      {
        "candidate_id": "c14",
        "horse_number": 14,
        "horse_name": "サンプルホースN",
        "model_rank": 14,
        "win_prob": 0.02,
        "mark": "none"
      },
      {
        "candidate_id": "c15",
        "horse_number": 15,
        "horse_name": "サンプルホースO",
        "model_rank": 15,
        "win_prob": 0.02,
        "mark": "none"
      }
    ]
  },
  "ai_confidence": {
    "schema_version": "single-ai-confidence/1.0",
    "status": "ok",
    "score": 0.62,
    "score_unit": "normalized",
    "band": "medium",
    "inputs_ref": {
      "schema_version": "single-confidence-inputs-ref/1.0",
      "kpi_snapshot_id": "kpi08-baseline-01-dummy",
      "evaluation_fingerprint": "dummy-eval-fp-20260719-hanshin-11",
      "used_channels": [
        "kpi08_historical",
        "evaluation_clarity"
      ]
    },
    "factors": [
      "clarity:top_gap_moderate",
      "kpi08:venue_strong"
    ],
    "component_scores": {
      "historical_fit": 0.7,
      "evaluation_clarity": 0.55
    },
    "notes": "プロトタイプ用ダミー。アルゴリズム未確定。",
    "computed_at": "2026-07-19T12:00:00+09:00"
  },
  "explain": {
    "meta": {
      "world": "dummy_world",
      "sub_world": "dummy_sub",
      "strategy_id": "proto-trifecta-trio-v0",
      "confidence_band": "medium"
    },
    "reasons": [
      {
        "candidate_id": "c07",
        "horse_number": 7,
        "bullets": [
          "上位確率が分離しており本命候補",
          "ダート適性のダミー説明"
        ]
      },
      {
        "candidate_id": "c03",
        "horse_number": 3,
        "bullets": [
          "相手関係から対抗",
          "前走内容のダミー説明"
        ]
      },
      {
        "candidate_id": "c12",
        "horse_number": 12,
        "bullets": [
          "穴候補としてのダミー説明"
        ]
      }
    ],
    "narrative": "本命7は上位確率がやや分離。対抗3・穴12を軸に三連系を構成するダミー説明です。"
  },
  "betting_recommendations": {
    "schema_version": "single-betting-recommendations/1.0",
    "race_id": "20260719_hanshin_11",
    "generated_at": "2026-07-19T12:00:00+09:00",
    "strategy_id": "proto-trifecta-trio-v0",
    "status": "ok",
    "items": [
      {
        "recommendation_id": "tf-1",
        "bet_type": "trifecta",
        "combination": {
          "schema_version": "single-combination/1.0",
          "selection_mode": "exact_order",
          "is_ordered": true,
          "cardinality": 3,
          "legs": [
            { "position": 1, "horse_number": 7, "candidate_id": "c07" },
            { "position": 2, "horse_number": 3, "candidate_id": "c03" },
            { "position": 3, "horse_number": 12, "candidate_id": "c12" }
          ]
        },
        "recommendation_rank": 1,
        "recommendation_score": 0.91,
        "score_unit": "normalized",
        "comment": "本命軸の順当目",
        "legs_display": "7-3-12",
        "derived_from": {
          "mark_codes": ["honmei", "taikou", "ana"],
          "candidate_ids": ["c07", "c03", "c12"],
          "strategy_step": "dummy"
        }
      },
      {
        "recommendation_id": "tf-2",
        "bet_type": "trifecta",
        "combination": {
          "schema_version": "single-combination/1.0",
          "selection_mode": "exact_order",
          "is_ordered": true,
          "cardinality": 3,
          "legs": [
            { "position": 1, "horse_number": 7, "candidate_id": "c07" },
            { "position": 2, "horse_number": 3, "candidate_id": "c03" },
            { "position": 3, "horse_number": 5, "candidate_id": "c05" }
          ]
        },
        "recommendation_rank": 2,
        "recommendation_score": 0.84,
        "score_unit": "normalized",
        "comment": "△を3着に置いた形",
        "legs_display": "7-3-5"
      },
      {
        "recommendation_id": "tf-3",
        "bet_type": "trifecta",
        "combination": {
          "schema_version": "single-combination/1.0",
          "selection_mode": "exact_order",
          "is_ordered": true,
          "cardinality": 3,
          "legs": [
            { "position": 1, "horse_number": 7, "candidate_id": "c07" },
            { "position": 2, "horse_number": 12, "candidate_id": "c12" },
            { "position": 3, "horse_number": 3, "candidate_id": "c03" }
          ]
        },
        "recommendation_rank": 3,
        "recommendation_score": 0.79,
        "score_unit": "normalized",
        "legs_display": "7-12-3"
      },
      {
        "recommendation_id": "tf-4",
        "bet_type": "trifecta",
        "combination": {
          "schema_version": "single-combination/1.0",
          "selection_mode": "exact_order",
          "is_ordered": true,
          "cardinality": 3,
          "legs": [
            { "position": 1, "horse_number": 3, "candidate_id": "c03" },
            { "position": 2, "horse_number": 7, "candidate_id": "c07" },
            { "position": 3, "horse_number": 12, "candidate_id": "c12" }
          ]
        },
        "recommendation_rank": 4,
        "recommendation_score": 0.71,
        "score_unit": "normalized",
        "comment": "対抗先頭の入れ替え",
        "legs_display": "3-7-12"
      },
      {
        "recommendation_id": "tf-5",
        "bet_type": "trifecta",
        "combination": {
          "schema_version": "single-combination/1.0",
          "selection_mode": "exact_order",
          "is_ordered": true,
          "cardinality": 3,
          "legs": [
            { "position": 1, "horse_number": 7, "candidate_id": "c07" },
            { "position": 2, "horse_number": 5, "candidate_id": "c05" },
            { "position": 3, "horse_number": 3, "candidate_id": "c03" }
          ]
        },
        "recommendation_rank": 5,
        "recommendation_score": 0.66,
        "score_unit": "normalized",
        "legs_display": "7-5-3"
      },
      {
        "recommendation_id": "tr-1",
        "bet_type": "trio",
        "combination": {
          "schema_version": "single-combination/1.0",
          "selection_mode": "unordered_set",
          "is_ordered": false,
          "cardinality": 3,
          "legs": [
            { "horse_number": 3, "candidate_id": "c03" },
            { "horse_number": 7, "candidate_id": "c07" },
            { "horse_number": 12, "candidate_id": "c12" }
          ]
        },
        "recommendation_rank": 1,
        "recommendation_score": 0.88,
        "score_unit": "normalized",
        "comment": "印3頭の基本セット",
        "legs_display": "3-7-12"
      },
      {
        "recommendation_id": "tr-2",